{
  "schema_version": 1,
  "inventory_version": "m5-conformance-boundaries-v1",
  "source_plan": {
    "path": "planning/promoted/Plan_M5_Selected_v1.md",
    "sha256": "975d4d77ba821c5f956303ebcf6c5283be1372f0c1cae425b3e6c6996259d5aa",
    "requirement": "M5-04",
    "sections": [2, 3, 4, 6]
  },
  "proof_scopes": {"synthetic-memory":"actual-memory","filesystem-posix":"actual-posix","stdio":"actual-stdio"},
  "requirements": [
    {"id":"source-configured","citation":"M5-04; section 4 configured source boundary","tracks":["synthetic-memory","filesystem-posix"],"probe_ids":["source-list","source-policy","allowed-read"],"expectation":{"kind":"source-policy","metric":null,"maximum":null,"unit":null}},
    {"id":"source-unknown","citation":"M5-04; section 4 unknown/missing sources","tracks":["synthetic-memory","filesystem-posix"],"probe_ids":["unknown-source"],"expectation":{"kind":"structured-refusal","metric":null,"maximum":null,"unit":null}},
    {"id":"source-missing-file","citation":"M5-04; section 4 missing configured source","tracks":["filesystem-posix"],"probe_ids":["missing-source"],"expectation":{"kind":"structured-refusal","metric":null,"maximum":null,"unit":null}},
    {"id":"path-traversal","citation":"M5-04; section 4 traversal","tracks":["synthetic-memory","filesystem-posix"],"probe_ids":["opaque-source-0"],"expectation":{"kind":"before-io-refusal","metric":null,"maximum":null,"unit":null}},
    {"id":"path-absolute","citation":"M5-04; section 4 absolute paths","tracks":["synthetic-memory","filesystem-posix"],"probe_ids":["opaque-source-1","opaque-source-2"],"expectation":{"kind":"before-io-refusal","metric":null,"maximum":null,"unit":null}},
    {"id":"path-device","citation":"M5-04; section 4 device paths","tracks":["synthetic-memory","filesystem-posix"],"probe_ids":["device-path"],"expectation":{"kind":"before-io-refusal","metric":null,"maximum":null,"unit":null}},
    {"id":"path-unc","citation":"M5-04; section 4 UNC paths","tracks":["synthetic-memory","filesystem-posix"],"probe_ids":["opaque-source-3"],"expectation":{"kind":"before-io-refusal","metric":null,"maximum":null,"unit":null}},
    {"id":"path-ads","citation":"M5-04; section 4 ADS paths","tracks":["synthetic-memory","filesystem-posix"],"probe_ids":["opaque-source-4"],"expectation":{"kind":"before-io-refusal","metric":null,"maximum":null,"unit":null}},
    {"id":"opaque-source-id","citation":"M5-04; section 3 configured opaque source ID","tracks":["synthetic-memory","filesystem-posix"],"probe_ids":["opaque-source-5"],"expectation":{"kind":"bounded-source-id","metric":null,"maximum":null,"unit":null}},
    {"id":"posix-no-follow","citation":"M5-04; section 4 actual open-handle/path checks and symlink escape","tracks":["filesystem-posix"],"probe_ids":["posix-symlink"],"expectation":{"kind":"actual-path-refusal","metric":null,"maximum":null,"unit":null}},
    {"id":"posix-open-rename","citation":"M5-04; section 4 supported rename races","tracks":["filesystem-posix"],"probe_ids":["posix-rename"],"expectation":{"kind":"actual-path-refusal","metric":null,"maximum":null,"unit":null}},
    {"id":"posix-source-generation","citation":"M5-04; section 4 supported source identity checks","tracks":["filesystem-posix"],"probe_ids":["posix-source-change"],"expectation":{"kind":"actual-path-refusal","metric":null,"maximum":null,"unit":null}},
    {"id":"posix-nonlocal","citation":"M5-04; section 4 nonlocal sources; unsupported remains unsupported","tracks":["filesystem-posix"],"probe_ids":["posix-nonlocal"],"expectation":{"kind":"actual-locality-refusal","metric":null,"maximum":null,"unit":null}},
    {"id":"posix-binary","citation":"M5-04; section 4 binary sources","tracks":["filesystem-posix"],"probe_ids":["binary-content"],"expectation":{"kind":"structured-refusal","metric":null,"maximum":null,"unit":null}},
    {"id":"posix-encoding","citation":"M5-04; section 4 unsupported encoding","tracks":["filesystem-posix"],"probe_ids":["unsupported-encoding"],"expectation":{"kind":"structured-refusal","metric":null,"maximum":null,"unit":null}},
    {"id":"total-read-bytes","citation":"M5-04; section 4 total read across all scans <=8 MiB","tracks":["synthetic-memory","filesystem-posix"],"probe_ids":["read-byte-cap"],"expectation":{"kind":"cap-refusal","metric":"read_bytes","maximum":8388608,"unit":"bytes"}},
    {"id":"read-amplification","citation":"M5-04; section 4 read amplification across scans","tracks":["synthetic-memory","filesystem-posix"],"probe_ids":["read-amplification"],"expectation":{"kind":"cap-refusal","metric":"aggregate_read_bytes","maximum":8388608,"unit":"bytes"}},
    {"id":"input-frame-bytes","citation":"M5-04; section 4 complete serialized JSON-RPC frame <=32 KiB","tracks":["synthetic-memory","filesystem-posix"],"probe_ids":["input-frame-cap"],"expectation":{"kind":"cap-refusal","metric":"input_frame_bytes","maximum":32768,"unit":"bytes"}},
    {"id":"escaped-output-frame","citation":"M5-04; section 4 escaping/frame amplification including envelope","tracks":["synthetic-memory","filesystem-posix"],"probe_ids":["frame-amplification"],"expectation":{"kind":"cap-refusal","metric":"complete_output_frame_bytes","maximum":32768,"unit":"bytes"}},
    {"id":"stdio-frame-bytes","citation":"M5-04; section 4 complete frame and escaping caps","tracks":["stdio"],"probe_ids":["stdio-input-frame","stdio-output-amplification","stdio-escaping"],"expectation":{"kind":"cap-refusal","metric":"complete_frame_bytes","maximum":32768,"unit":"bytes"}},
    {"id":"physical-line-bytes","citation":"M5-04; section 4 physical-line limit 64 KiB","tracks":["synthetic-memory","filesystem-posix"],"probe_ids":["physical-line-cap"],"expectation":{"kind":"cap-refusal","metric":"physical_line_bytes","maximum":65536,"unit":"bytes"}},
    {"id":"output-line-count","citation":"M5-04; section 4 <=500 returned lines","tracks":["synthetic-memory","filesystem-posix"],"probe_ids":["line-count-cap","range-cap"],"expectation":{"kind":"cap-refusal","metric":"returned_lines","maximum":500,"unit":"lines"}},
    {"id":"call-deadline","citation":"M5-04; section 4 deadline <=5 seconds","tracks":["synthetic-memory","filesystem-posix"],"probe_ids":["deadline"],"expectation":{"kind":"deadline-refusal","metric":"call_deadline","maximum":5,"unit":"seconds"}},
    {"id":"cursor-integrity","citation":"M5-04; section 4 stale cursors","tracks":["synthetic-memory","filesystem-posix"],"probe_ids":["cursor-corruption","cursor-binding"],"expectation":{"kind":"structured-refusal","metric":null,"maximum":null,"unit":null}},
    {"id":"cursor-length","citation":"M5-04; section 4 cursor cap 4096 characters","tracks":["synthetic-memory","filesystem-posix"],"probe_ids":["cursor-length-cap"],"expectation":{"kind":"cap-refusal","metric":"cursor_length","maximum":4096,"unit":"characters"}},
    {"id":"local-concurrency","citation":"M5-04; section 4 four active/sixteen queued with BUSY","tracks":["synthetic-memory","filesystem-posix"],"probe_ids":["concurrency-cap"],"expectation":{"kind":"occupancy-and-busy","metric":"active_calls","maximum":4,"unit":"calls"}},
    {"id":"local-queue-depth","citation":"M5-04; section 4 sixteen queued","tracks":["synthetic-memory","filesystem-posix"],"probe_ids":["concurrency-cap"],"expectation":{"kind":"occupancy-and-busy","metric":"queued_calls","maximum":16,"unit":"calls"}},
    {"id":"stdio-concurrency","citation":"M5-04; section 4 concurrency through real stdio","tracks":["stdio"],"probe_ids":["stdio-concurrency"],"expectation":{"kind":"occupancy-and-busy","metric":"active_calls","maximum":4,"unit":"calls"}},
    {"id":"stdio-queue-depth","citation":"M5-04; section 4 sixteen queued through stdio","tracks":["stdio"],"probe_ids":["stdio-concurrency"],"expectation":{"kind":"occupancy-and-busy","metric":"queued_calls","maximum":16,"unit":"calls"}},
    {"id":"stdio-cancellation","citation":"M5-04; section 4 cancellation/deadline","tracks":["stdio"],"probe_ids":["stdio-cancellation"],"expectation":{"kind":"actual-cancellation","metric":null,"maximum":null,"unit":null}},
    {"id":"redaction","citation":"M5-04; section 4 independent hardened redaction","tracks":["synthetic-memory","filesystem-posix"],"probe_ids":["custom-redaction"],"expectation":{"kind":"redaction-with-utility","metric":null,"maximum":null,"unit":null}},
    {"id":"custom-rule-count","citation":"M5-04; section 4 <=32 custom rules","tracks":["synthetic-memory","filesystem-posix"],"probe_ids":["custom-rule-count-cap"],"expectation":{"kind":"cap-refusal","metric":"custom_rules","maximum":32,"unit":"rules"}},
    {"id":"configured-source-count","citation":"M5-04; section 4 <=100 configured sources","tracks":["synthetic-memory","filesystem-posix"],"probe_ids":["source-count-cap"],"expectation":{"kind":"cap-refusal","metric":"configured_sources","maximum":100,"unit":"sources"}},
    {"id":"pattern-utf8-bytes","citation":"M5-04; section 4 pattern cap 512 UTF-8 bytes","tracks":["synthetic-memory","filesystem-posix"],"probe_ids":["semantic-utf8-byte-cap"],"expectation":{"kind":"before-io-refusal","metric":"pattern_bytes","maximum":512,"unit":"bytes"}},
    {"id":"strict-argument-validation","citation":"M5-04; sections 2/4 malformed/duplicate/nonfinite validation before I/O","tracks":["synthetic-memory","filesystem-posix"],"probe_ids":["duplicate-json","nonfinite-json","strict-integer","extra-field"],"expectation":{"kind":"before-io-refusal","metric":null,"maximum":null,"unit":null}},
    {"id":"stdio-validation","citation":"M5-04; sections 2/4 actual protocol/schema validation","tracks":["stdio"],"probe_ids":["stdio-duplicate","stdio-nonfinite","stdio-unknown-method","stdio-policy-error"],"expectation":{"kind":"protocol-and-policy-refusal","metric":null,"maximum":null,"unit":null}},